{
  "framework": "ASVS",
  "rows": [
    {
      "description": "",
      "row": "v5.0.0-1.1.2",
      "section": "V1.1",
      "title": "Encoding and Sanitization Architecture"
    },
    {
      "description": "",
      "row": "v5.0.0-1.2.1",
      "section": "V1.2",
      "title": "Injection Prevention"
    },
    {
      "description": "",
      "row": "v5.0.0-1.2.2",
      "section": "V1.2",
      "title": "Injection Prevention"
    },
    {
      "description": "",
      "row": "v5.0.0-1.2.3",
      "section": "V1.2",
      "title": "Injection Prevention"
    },
    {
      "description": "",
      "row": "v5.0.0-11.1.1",
      "section": "V11.1",
      "title": "Cryptographic Inventory and Documentation"
    },
    {
      "description": "",
      "row": "v5.0.0-11.2.1",
      "section": "V11.2",
      "title": "Secure Cryptography Implementation"
    },
    {
      "description": "",
      "row": "v5.0.0-11.3.2",
      "section": "V11.3",
      "title": "Encryption Algorithms"
    },
    {
      "description": "",
      "row": "v5.0.0-11.4.2",
      "section": "V11.4",
      "title": "Hashing and Hash-based Functions"
    },
    {
      "description": "",
      "row": "v5.0.0-11.5.1",
      "section": "V11.5",
      "title": "Random Values"
    },
    {
      "description": "",
      "row": "v5.0.0-14.1.1",
      "section": "V14.1",
      "title": "Data Protection Documentation"
    },
    {
      "description": "",
      "row": "v5.0.0-14.2.1",
      "section": "V14.2",
      "title": "General Data Protection"
    },
    {
      "description": "",
      "row": "v5.0.0-14.2.6",
      "section": "V14.2",
      "title": "General Data Protection"
    },
    {
      "description": "",
      "row": "v5.0.0-14.2.7",
      "section": "V14.2",
      "title": "General Data Protection"
    },
    {
      "description": "",
      "row": "v5.0.0-14.3.2",
      "section": "V14.3",
      "title": "Client-side Data Protection"
    },
    {
      "description": "",
      "row": "v5.0.0-15.1.1",
      "section": "V15.1",
      "title": "Secure Coding and Architecture Documentation"
    },
    {
      "description": "",
      "row": "v5.0.0-15.1.2",
      "section": "V15.1",
      "title": "Secure Coding and Architecture Documentation"
    },
    {
      "description": "",
      "row": "v5.0.0-15.2.1",
      "section": "V15.2",
      "title": "Security Architecture and Dependencies"
    },
    {
      "description": "",
      "row": "v5.0.0-15.2.4",
      "section": "V15.2",
      "title": "Security Architecture and Dependencies"
    },
    {
      "row": "v5.0.0-16.1.1",
      "section": "V16.1",
      "title": "v5.0.0-16.1.1"
    },
    {
      "description": "",
      "row": "v5.0.0-16.2.1",
      "section": "V16.2",
      "title": "Governed service methods declare audit event metadata"
    },
    {
      "description": "",
      "row": "v5.0.0-16.3.1",
      "section": "V16.3",
      "title": "Governed service methods declare audit event metadata"
    },
    {
      "description": "",
      "row": "v5.0.0-2.1.1",
      "section": "V2.1",
      "title": "Validation and Business Logic Documentation"
    },
    {
      "description": "",
      "row": "v5.0.0-2.2.1",
      "section": "V2.2",
      "title": "Input Validation"
    },
    {
      "description": "",
      "row": "v5.0.0-2.2.2",
      "section": "V2.2",
      "title": "Input Validation"
    },
    {
      "description": "",
      "row": "v5.0.0-2.3.2",
      "section": "V2.3",
      "title": "Business Logic Security"
    },
    {
      "description": "",
      "row": "v5.0.0-3.3.1",
      "section": "V3.3",
      "title": "Cookie Setup"
    },
    {
      "description": "",
      "row": "v5.0.0-3.3.2",
      "section": "V3.3",
      "title": "Cookie Setup"
    },
    {
      "description": "",
      "row": "v5.0.0-3.3.4",
      "section": "V3.3",
      "title": "Cookie Setup"
    },
    {
      "description": "",
      "row": "v5.0.0-3.4.1",
      "section": "V3.4",
      "title": "Browser Security Mechanism Headers"
    },
    {
      "description": "",
      "row": "v5.0.0-3.4.3",
      "section": "V3.4",
      "title": "Browser Security Mechanism Headers"
    },
    {
      "description": "",
      "row": "v5.0.0-3.4.4",
      "section": "V3.4",
      "title": "Browser Security Mechanism Headers"
    },
    {
      "description": "",
      "row": "v5.0.0-5.1.1",
      "section": "V5.1",
      "title": "File Handling Documentation"
    },
    {
      "description": "",
      "row": "v5.0.0-5.2.1",
      "section": "V5.2",
      "title": "File Upload and Content"
    },
    {
      "description": "",
      "row": "v5.0.0-5.2.2",
      "section": "V5.2",
      "title": "File Upload and Content"
    },
    {
      "description": "",
      "row": "v5.0.0-5.3.2",
      "section": "V5.3",
      "title": "File Storage"
    },
    {
      "description": "",
      "row": "v5.0.0-5.4.3",
      "section": "V5.4",
      "title": "File Download"
    },
    {
      "description": "",
      "row": "v5.0.0-7.1.1",
      "section": "V7.1",
      "title": "Session Management Documentation"
    },
    {
      "description": "",
      "row": "v5.0.0-7.2.1",
      "section": "V7.2",
      "title": "Fundamental Session Management Security"
    },
    {
      "description": "",
      "row": "v5.0.0-7.2.4",
      "section": "V7.2",
      "title": "Fundamental Session Management Security"
    },
    {
      "description": "",
      "row": "v5.0.0-7.3.1",
      "section": "V7.3",
      "title": "Session Timeout"
    },
    {
      "description": "",
      "row": "v5.0.0-7.4.1",
      "section": "V7.4",
      "title": "Session Termination"
    },
    {
      "description": "",
      "row": "v5.0.0-8.1.1",
      "section": "V8.1",
      "title": "Authorization Documentation"
    },
    {
      "description": "",
      "row": "v5.0.0-8.2.1",
      "section": "V8.2",
      "title": "General Authorization Design"
    },
    {
      "description": "",
      "row": "v5.0.0-8.2.2",
      "section": "V8.2",
      "title": "General Authorization Design"
    },
    {
      "description": "",
      "row": "v5.0.0-8.3.1",
      "section": "V8.3",
      "title": "Operation Level Authorization"
    },
    {
      "description": "",
      "row": "v5.0.0-8.4.2",
      "section": "V8.4",
      "title": "Other Authorization Considerations"
    },
    {
      "description": "",
      "row": "v5.0.0-9.1.1",
      "section": "V9.1",
      "title": "Token source and integrity"
    },
    {
      "description": "",
      "row": "v5.0.0-9.1.2",
      "section": "V9.1",
      "title": "Token source and integrity"
    },
    {
      "description": "",
      "row": "v5.0.0-9.2.1",
      "section": "V9.2",
      "title": "Token content"
    },
    {
      "description": "",
      "row": "v5.0.0-9.2.3",
      "section": "V9.2",
      "title": "Token content"
    }
  ],
  "schema_version": 1,
  "source": {
    "license": "CC-BY-SA-4.0",
    "retrieved_at": "2026-07-13T00:00:00Z",
    "url": "https://owasp.org/www-project-application-security-verification-standard/"
  },
  "version": "5.0.0"
}